{
 "id": "S035",
 "prompt_id": "hand_built",
 "source": {
  "kind": "hand_built",
  "model_family": null,
  "model_id": null,
  "note": "seed case; proves the harness, says nothing about any model"
 },
 "stated_design": {
  "part_id": "vishay-crcw2010",
  "source_voltage_v": 13.693063937629153,
  "resistance_ohm": 100.0,
  "reference_temperature_c": 20.0,
  "temperature_coefficient_ppm_per_k": 99.99999999999999,
  "ambient_c": 25,
  "duration_s": 60.0,
  "thermal_resistance_k_per_w": 16.0,
  "thermal_resistance_kind": "body_to_ambient",
  "heat_capacity_j_per_k": 0.021675,
  "declared_thermal_context": {
   "characteristic_length_m": 0.00022058823529411763,
   "surface_area_m2": 3.4e-05,
   "body_volume_m3": 7.5e-09,
   "body_conductivity_w_per_m_k": 30.0,
   "surface_emissivity": 0.05,
   "melting_temperature_c": 2072.0,
   "constant_conductance_span_k": 900.0,
   "constant_capacity_span_k": 900.0,
   "linearization_band_k": 2000.0,
   "debye_temperature_k": 200.0,
   "fluid": "air",
   "convection_length_m": 0.0058309518948453,
   "fluid_conductivity_solved_w_per_m_k": 3.3871835958358556,
   "airflow": "still"
  },
  "declared_limits": {
   "rated_power_w": 0.75,
   "maximum_working_voltage_v": 400,
   "maximum_operating_temperature_c": 155,
   "source_maximum_current_a": 0.4093634167716921
  }
 },
 "reasoning": {},
 "label": {
  "verdict": "limit_exceeded",
  "reason": "dissipates 1.875 W against the CRCW2010 e3's 0.75 W rating -- 2.5 times the number the datasheet prints.",
  "labeller": "benchmark author (single reviewer)",
  "confidence": "high",
  "ground_truth_basis": "reference.py plus the part datasheet",
  "reference_check": {
   "violated": [
    "dissipated_power_utilization"
   ],
   "unknown_count": 0,
   "final_temperature_k": 328.0457,
   "steady_temperature_k": 328.0457,
   "dissipated_power_w": 1.86848,
   "stable_under_both_temperature_readings": true
  }
 },
 "expected_verdict": "NOT_SUPPORTED",
 "declaration_completeness": "full_declaration"
}
